"index","word","meaning","furi","pos","e.g.","e.g.[voc]","e.g.[eng]"
"953","入場券","entrance ticket","入場券[にゅうじょうけん]","Noun","<b> 入場券[にゅうじょうけん]</b>は 3000円[さんぜんえん]です。","<b>入場券</b>は3000円です。","The admission ticket is 3,000 yen."
"954","家賃","rent (money)","家賃[やちん]","Noun","ここの<b> 家賃[やちん]</b>は 12万円[じゅうにまんえん]です。","ここの<b>家賃</b>は12万円です。","The rent here is 120,000 yen."
"955","時代","age, era, antiquity","時代[じだい]","Noun","今[いま]は 便利[べんり]さとスピードの<b> 時代[じだい]</b>だ。","今は便利さとスピードの<b>時代</b>だ。","This is the age of convenience and speed."
"956","ポケット","pocket","ポケット","Noun","財布[さいふ]を<b>ポケット</b>にしまった。","財布を<b>ポケット</b>にしまった。","I put my wallet in my pocket."
"957","代わる","take (st/sb's) place, substitute for","代[か]わる","Verb","上司[じょうし]に<b> 代[か]わって</b> 会議[かいぎ]に 出[で]た。","上司に<b>代わって</b>会議に出た。","I attended the conference in place of my boss."
"958","代える","replace (O1を) with (O2に), substitute","代[か]える","Verb","社長[しゃちょう]に<b> 代[か]えて</b> 部長[ぶちょう]を 出席[しゅっせき]させます。","社長に<b>代えて</b>部長を出席させます。","I'll have the department manager attend in place of the president."
"959","指","finger, toe","指[ゆび]","Noun","彼[かれ]は<b> 指[ゆび]</b>が 太[ふと]い。","彼は<b>指</b>が太い。","His fingers are fat."
"960","決定","decision","決定[けってい]","Verbal Noun","会議[かいぎ]で 重要[じゅうよう]な<b> 決定[けってい]</b>がありました。","会議で重要な<b>決定</b>がありました。","An important decision was made at the conference."
"961","そろそろ","soon, slowly, gingerly","そろそろ","Adverb","<b>そろそろ</b> 始[はじ]めましょうか。","<b>そろそろ</b>始めましょうか。","It's about time to begin."
"962","一定","constant, fixed","一定[いってい]","Verbal Noun","申[もう]し 込[こ]むには<b> 一定[いってい]</b>の 資格[しかく]が 要[い]る。","申し込むには<b>一定</b>の資格が要る。","You need certain qualifications to apply."
"963","定期券","commuter pass","定期券[ていきけん]","Noun","<b> 定期券[ていきけん]</b>は 1万2千円[いちまんにせんえん]でした。","<b>定期券</b>は1万2千円でした。","The commuter pass was 1,2000 yen."
"964","予定","schedule, plan","予定[よてい]","Verbal Noun","今日[きょう]の<b> 予定[よてい]</b>を 教[おし]えてください。","今日の<b>予定</b>を教えてください。","Please tell me what your schedule is for today."
"965","天気予報","weather forecast","天気予報[てんきよほう]","Noun","明日[あした]の<b> 天気予報[てんきよほう]</b>は 雨[あめ]です。","明日の<b>天気予報</b>は雨です。","Rain is forecast for tomorrow."
"966","ぶどう","grapes","ぶどう","Noun","私[わたし]は<b>ぶどう</b>が 好[す]きです。","私は<b>ぶどう</b>が好きです。","I like grapes."
"967","予習","preparation for class","予習[よしゅう]","Verbal Noun","明日[あした]の<b> 予習[よしゅう]</b>をしましょう。","明日の<b>予習</b>をしましょう。","Let's prepare for tomorrow."
"968","予約","reservation, subscription, appointment","予約[よやく]","Verbal Noun","レストランを<b> 予約[よやく]</b>しました。","レストランを<b>予約</b>しました。","I made a reservation at the restaurant."
"969","約束","promise, vow","約束[やくそく]","Verbal Noun","<b> 約束[やくそく]</b>は 守[まも]ります。","<b>約束</b>は守ります。","I keep my promises."
"970","変わる","change が","変[か]わる","Verb","信号[しんごう]が 青[あお]に<b> 変[か]わりました</b>。","信号が青に<b>変わりました</b>。","The traffic light turned green."
"971","めったに","rarely","めったに","Adverb","彼女[かのじょ]は<b>めったに</b> 怒[おこ]りません。","彼女は<b>めったに</b>怒りません。","She rarely gets angry."
"972","大変","awful, serious","大変[たいへん]","Adjectival Noun","<b> 大変[たいへん]</b>なことが 起[お]こりました。","<b>大変</b>なことが起こりました。","A terrible thing happened."
"973","変","strange, weird, funny","変[へん]","Adjectival Noun","<b> 変[へん]</b>な 音[おと]が 聞[き]こえます。","<b>変</b>な音が聞こえます。","I hear a strange sound."
"974","変化","change","変化[へんか]","Verbal Noun","今年[ことし]は<b> 変化[へんか]</b>の 多[おお]い 年[とし]でした。","今年は<b>変化</b>の多い年でした。","There was a lot of change this year."
"975","強化","strengthening","強化[きょうか]","Verbal Noun","国[くに]は 国語教育[こくご きょういく]を<b> 強化[きょうか]</b>しています。","国は国語教育を<b>強化</b>しています。","Our government is strengthening its program in native language education."
"976","クリスマス","Christmas","クリスマス","Noun","<b>クリスマス</b>にはケーキを 食[た]べます。","<b>クリスマス</b>にはケーキを食べます。","We eat cake at Christmas."
"977","文化","culture","文化[ぶんか]","Noun","私[わたし]はこの 国[くに]の<b> 文化[ぶんか]</b>を 勉強[べんきょう]しています。","私はこの国の<b>文化</b>を勉強しています。","I'm studying this country's culture."
"978","増える","increase, accrue が","増[ふ]える","Verb","この 町[まち]は 人口[じんこう]が<b> 増[ふ]えた</b>。","この町は人口が<b>増えた</b>。","The population has increased in this town."
"979","増やす","increase (something), add を","増[ふ]やす","Verb","あの 町[まち]は 緑[みどり]を<b> 増[ふ]やしています</b>。","あの町は緑を<b>増やしています</b>。","That town is increasing its greenery."
"980","減る","decrease, diminish が","減[へ]る","Verb","体重[たいじゅう]がかなり<b> 減[へ]りました</b>。","体重がかなり<b>減りました</b>。","I've lost a lot of weight."
"981","ネクタイ","tie, necktie","ネクタイ","Noun","父[ちち]の 日[ひ]に<b>ネクタイ</b>をプレゼントした。","父の日に<b>ネクタイ</b>をプレゼントした。","I gave him a tie on Father's Day."
"982","減らす","decrease (something), reduce を","減[へ]らす","Verb","最近[さいきん]、 食事[しょくじ]を<b> 減[へ]らしています</b>。","最近、食事を<b>減らしています</b>。","I've been eating less recently."
"983","乗り物","vehicle, means of transportation","乗[の]り 物[もの]","Noun","自転車[じてんしゃ]は 便利[べんり]な<b> 乗[の]り 物[もの]</b>です。","自転車は便利な<b>乗り物</b>です。","Bicycles are a convenient form of transport."
"984","降りる","get off, land","降[お]りる","Verb","次[つぎ]の 駅[えき]で<b> 降[お]ります</b>。","次の駅で<b>降ります</b>。","I get off at the next station."
"985","降ろす","unload, lower","降[お]ろす","Verb","彼[かれ]は 車[くるま]から 荷物[にもつ]を<b> 降[お]ろした</b>。","彼は車から荷物を<b>降ろした</b>。","He unloaded the luggage from the car."
"986","バイオリン","violin","バイオリン","Noun","彼女[かのじょ]は<b>バイオリン</b>を 習[なら]っています。","彼女は<b>バイオリン</b>を習っています。","She's learning the violin."
"987","降る","fall, come down, rain","降[ふ]る","Verb","激[はげ]しい 雨[あめ]が<b> 降[ふ]っています</b>。","激しい雨が<b>降っています</b>。","A very heavy rain is falling."
"988","着く","arrive, touch, take one's place","着[つ]く","Verb","午後8時[ごご はちじ]に 大阪[おおさか]に<b> 着[つ]きます</b>。","午後8時に大阪に<b>着きます</b>。","I arrive in Osaka at 8:00 pm."
"989","着物","kimono, clothes","着物[きもの]","Noun","彼女[かのじょ]は<b> 着物[きもの]</b>がよく 似合[にあ]います。","彼女は<b>着物</b>がよく似合います。","She looks good in a kimono."
"990","下着","underwear","下着[したぎ]","Noun","私[わたし]は<b> 下着[したぎ]</b>を 手[て]で 洗[あら]う。","私は<b>下着</b>を手で洗う。","I wash my underwear by hand."
"991","パスポート","passport","パスポート","Noun","<b>パスポート</b>が 見[み]つからない。","<b>パスポート</b>が見つからない。","I can't find my passport."
"992","上着","outerwear","上着[うわぎ]","Noun","暑[あつ]いので<b> 上着[うわぎ]</b>を 脱[ぬ]ぎました。","暑いので<b>上着</b>を脱ぎました。","I took my jacket off because it was hot."
"993","着せる","dress (sb), put clothes on (sb)","着[き]せる","Verb","娘[むすめ]にかわいいドレスを<b> 着[き]せた</b>。","娘にかわいいドレスを<b>着せた</b>。","I dressed my daughter in a cute dress."
"994","脱ぐ","remove clothes, take off","脱[ぬ]ぐ","Verb","靴[くつ]を<b> 脱[ぬ]いで</b>ください。","靴を<b>脱いで</b>ください。","Please take off your shoes."
"995","立場","standpoint, position","立場[たちば]","Noun","彼女[かのじょ]は 自分[じぶん]の<b> 立場[たちば]</b>を 分[わ]かっていない。","彼女は自分の<b>立場</b>を分かっていない。","She doesn't understand her position."
"996","バッグ","bag","バッグ","Noun","私[わたし]は 黒[くろ]い<b>バッグ</b>を 持[も]っています。","私は黒い<b>バッグ</b>を持っています。","I have a black bag."
"997","目立つ","stand out, be conspicuous","目立[めだ]つ","Verb","彼女[かのじょ]の 大[おお]きな 帽子[ぼうし]はとても<b> 目立[めだ]つ</b>。","彼女の大きな帽子はとても<b>目立つ</b>。","Her big hat really stands out."
"998","立てる","stand (sth) up, set (sth) up, establish","立[た]てる","Verb","彼[かれ]はケーキにろうそくを<b> 立[た]てた</b>。","彼はケーキにろうそくを<b>立てた</b>。","He stuck the candles into the cake."
"999","役に立つ","be useful, be helpful","役[やく]に 立[た]つ","Verb","私[わたし]は 人々[ひとびと]の<b> 役[やく]に 立[た]ちたい</b>と 思[おも]っています。","私は人々の<b>役に立ちたい</b>と思っています。","I want to be of service to others."
"1000","出席","attendance, presence","出席[しゅっせき]","Verbal Noun","午後[ごご]は 会議[かいぎ]に<b> 出席[しゅっせき]</b>します。","午後は会議に<b>出席</b>します。","I'll attend a meeting in the afternoon."
"1001","ゴム","rubber, elastic","ゴム","Noun","<b>ゴム</b>が 伸[の]びてしまった。","<b>ゴム</b>が伸びてしまった。","The elastic has gone loose."
"1002","席","seat, one's place","席[せき]","Noun","この<b> 席[せき]</b>、 空[あ]いてますか。","この<b>席</b>、空いてますか。","Is this seat free?"
"1003","欠席","absence, non-attendance","欠席[けっせき]","Verbal Noun","風邪[かぜ]のため、 今日[きょう]は<b> 欠席[けっせき]</b>します。","風邪のため、今日は<b>欠席</b>します。","I'll be absent today because of a cold."
"1004","次男","second son","次男[じなん]","Noun","<b> 次男[じなん]</b>は 今[いま]、 海外[かいがい]にいます。","<b>次男</b>は今、海外にいます。","My second son is abroad now."
"1005","次女","second daughter","次女[じじょ]","Noun","うちの<b> 次女[じじょ]</b>は 春[はる]から 中学生[ちゅうがくせい]です。","うちの<b>次女</b>は春から中学生です。","Our second daughter is going into junior high this spring."
"1006","ギター","guitar","ギター","Noun","彼女[かのじょ]は<b>ギター</b>が 得意[とくい]です。","彼女は<b>ギター</b>が得意です。","She's good at the guitar."
"1007","運ぶ","carry, transport","運[はこ]ぶ","Verb","いすを 二階[にかい]に<b> 運[はこ]んで</b>ください。","いすを二階に<b>運んで</b>ください。","Please carry the chair to the second floor."
"1008","運転","drive","運転[うんてん]","Verbal Noun","父[ちち]は 安全[あんぜん]<b> 運転[うんてん]</b>だ。","父は安全<b>運転</b>だ。","My father drives safely."
"1009","運転手","driver","運転手[うんてんしゅ]","Noun","彼[かれ]はタクシーの<b> 運転手[うんてんしゅ]</b>です。","彼はタクシーの<b>運転手</b>です。","He's a taxi driver."
"1010","転ぶ","tumble down, fall over","転[ころ]ぶ","Verb","お 祖母[ばあ]ちゃんがお 風呂場[ふろば]で<b> 転[ころ]んだ</b>。","お祖母ちゃんがお風呂場で<b>転んだ</b>。","My grandma fell down in the bathroom."
"1011","セーター","sweater, pullover","セーター","Noun","この<b>セーター</b>はウールだ。","この<b>セーター</b>はウールだ。","This sweater is made of wool."
"1012","移る","move, shift が","移[うつ]る","Verb","彼女[かのじょ]は 新[あたら]しい 会社[かいしゃ]に<b> 移[うつ]った</b>。","彼女は新しい会社に<b>移った</b>。","She moved to a new company."
"1013","移す","move (something), shift, transfer","移[うつ]す","Verb","机[つくえ]を 窓[まど]のそばに<b> 移[うつ]しました</b>。","机を窓のそばに<b>移しました</b>。","I moved the desk near the window."
"1014","動き","movement, motion","動[うご]き","Noun","まず 相手[あいて]の<b> 動[うご]き</b>を 見[み]ましょう。","まず相手の<b>動き</b>を見ましょう。","First, watch your opponent's moves."
"1015","運動","exercise, movement","運動[うんどう]","Verbal Noun","彼[かれ]はもっと<b> 運動[うんどう]</b>した 方[ほう]がいい。","彼はもっと<b>運動</b>した方がいい。","He should exercise more."
"1016","やっぱり","just as I thought, after all","やっぱり","Adverb","<b>やっぱり</b> 旅[たび]が 大好[だいす]きだ。","<b>やっぱり</b>旅が大好きだ。","I just love to travel."
"1017","活動","activity","活動[かつどう]","Verbal Noun","彼[かれ]は 地域[ちいき]の<b> 活動[かつどう]</b>に 参加[さんか]した。","彼は地域の<b>活動</b>に参加した。","He took part in local activities."
"1018","動物","animal","動物[どうぶつ]","Noun","私[わたし]は<b> 動物[どうぶつ]</b>が 大好[だいす]きです。","私は<b>動物</b>が大好きです。","I love animals."
"1019","動かす","move (something), operate","動[うご]かす","Verb","部屋[へや]の 家具[かぐ]を<b> 動[うご]かしました</b>。","部屋の家具を<b>動かしました</b>。","I moved the furniture in the room."
"1020","不動産屋","real estate agent, realtor","不動産屋[ふどうさんや]","Noun","私[わたし]の 父[ちち]は<b> 不動産屋[ふどうさんや]</b>です。","私の父は<b>不動産屋</b>です。","My father's a real estate agent."
"1021","カーテン","curtain","カーテン","Noun","朝[あさ]、<b>カーテン</b>を 開[あ]けた。","朝、<b>カーテン</b>を開けた。","I opened the curtains in the morning."
"1022","早く","early, soon","早[はや]く","Adverb","なるべく<b> 早[はや]く</b> 来[き]て 下[くだ]さい。","なるべく<b>早く</b>来て下さい。","Please come as early as possible."
"1023","早口","fast talking","早口[はやくち]","Noun","彼女[かのじょ]は<b> 早口[はやくち]</b>だ。","彼女は<b>早口</b>だ。","She talks quickly."
"1024","速さ","speed","速[はや]さ","Noun","新幹線[しんかんせん]の<b> 速[はや]さ</b>はどれぐらいですか。","新幹線の<b>速さ</b>はどれぐらいですか。","How fast is the bullet train?"
"1025","速達","express mail","速達[そくたつ]","Noun","これを<b> 速達[そくたつ]</b>で 送[おく]りたいのですが。","これを<b>速達</b>で送りたいのですが。","I want to send this by express mail."
"1026","シャツ","shirt","シャツ","Noun","この<b>シャツ</b>はアイロンが 必要[ひつよう]だ。","この<b>シャツ</b>はアイロンが必要だ。","This shirt needs ironing."
"1027","遅れる","be late","遅[おく]れる","Verb","今朝彼女[けさ かのじょ]は 学校[がっこう]に<b> 遅[おく]れました</b>。","今朝彼女は学校に<b>遅れました</b>。","She was late for school this morning."
"1028","開始","beginning","開始[かいし]","Verbal Noun","運動会[うんどうかい]は 9時[くじ]<b> 開始[かいし]</b>です。","運動会は9時<b>開始</b>です。","The athletic meet begins at nine o'clock."
"1029","始めに","in the beginning","始[はじ]めに","Adverb","<b> 始[はじ]めに</b>スープが 出[で]ます。","<b>始めに</b>スープが出ます。","Soup is served first."
"1030","現在","the present, present time","現在[げんざい]","Noun","<b> 現在[げんざい]</b>の 気温[きおん]は 30度[さんじゅうど]です。","<b>現在</b>の気温は30度です。","The current temperature is 30 degrees."
"1031","ナイフ","knife","ナイフ","Noun","<b>ナイフ</b>で 手[て]を 切[き]った。","<b>ナイフ</b>で手を切った。","I cut my hand with a knife."
"1032","実現","realization, fulfillment","実現[じつげん]","Verbal Noun","夢[ゆめ]を<b> 実現[じつげん]</b>するには 努力[どりょく]が 必要[ひつよう]です。","夢を<b>実現</b>するには努力が必要です。","You need to make an effort to make your dreams come true."
"1033","実施","being in effect, implementation","実施[じっし]","Verbal Noun","現在[げんざい]、スペシャルキャンペーンを<b> 実施[じっし]</b> 中[ちゅう]です。","現在、スペシャルキャンペーンを<b>実施</b>中です。","A special campaign is now under way."
"1034","事実","fact, truth","事実[じじつ]","Noun","それは 全[すべ]て<b> 事実[じじつ]</b>ですか。","それは全て<b>事実</b>ですか。","Is it all true?"
"1035","実行","(putting into) practice, execution","実行[じっこう]","Verbal Noun","彼[かれ]はその 計画[けいかく]を<b> 実行[じっこう]</b>した。","彼はその計画を<b>実行</b>した。","He executed the plan."
"1036","バイク","motorcycle","バイク","Noun","兄[あに]は<b>バイク</b>が 大好[だいす]きです。","兄は<b>バイク</b>が大好きです。","My older brother loves motorcycles."
"1037","実験","experiment","実験[じっけん]","Verbal Noun","科学[かがく]の 授業[じゅぎょう]で<b> 実験[じっけん]</b>をした。","科学の授業で<b>実験</b>をした。","We did an experiment in science class."
"1038","通過","passing, passage","通過[つうか]","Verbal Noun","次[つぎ]の 駅[えき]は<b> 通過[つうか]</b>します。","次の駅は<b>通過</b>します。","This train will not stop at the next station."
"1039","過ぎる","pass by, exceed","過[す]ぎる","Verb","時[とき]が<b> 過[す]ぎる</b>のは 速[はや]い。","時が<b>過ぎる</b>のは速い。","Time passes quickly."
"1040","昼過ぎ","just past noon","昼過[ひるす]ぎ","Noun","彼[かれ]は<b> 昼過[ひるす]ぎ</b>に 来[き]ます。","彼は<b>昼過ぎ</b>に来ます。","He'll come after lunch."
"1041","いつか","some time, some day","いつか","Adverb","僕[ぼく]は<b>いつか</b>アフリカに 行[い]きたい。","僕は<b>いつか</b>アフリカに行きたい。","I want to go to Africa some time."
"1042","過去","the past","過去[かこ]","Noun","それは<b> 過去[かこ]</b>の 話[はなし]だ。","それは<b>過去</b>の話だ。","That's in the past now."
"1043","開発","development","開発[かいはつ]","Verbal Noun","ダムの<b> 開発[かいはつ]</b>に 住民[じゅうみん]は 反対[はんたい]しています。","ダムの<b>開発</b>に住民は反対しています。","The residents are against the development of the dam."
"1044","発生","occurrence, happening","発生[はっせい]","Verbal Noun","交差点[こうさてん]で 事故[じこ]が<b> 発生[はっせい]</b>した。","交差点で事故が<b>発生</b>した。","There was an accident at the intersection."
"1045","発言","statement, remark","発言[はつげん]","Verbal Noun","会議[かいぎ]で 全員[ぜんいん]が<b> 発言[はつげん]</b>した。","会議で全員が<b>発言</b>した。","Everyone spoke at the conference."
"1046","オレンジ","orange","オレンジ","Noun","私[わたし]は<b>オレンジ</b>が 好[す]きです。","私は<b>オレンジ</b>が好きです。","I like oranges."
"1047","発見","discovery, revelation","発見[はっけん]","Verbal Noun","新[あたら]しい 星[ほし]が<b> 発見[はっけん]</b>された。","新しい星が<b>発見</b>された。","A new star was discovered."
"1048","出発","departure, starting","出発[しゅっぱつ]","Verbal Noun","あと 15分[じゅうごふん]で<b> 出発[しゅっぱつ]</b>です。","あと15分で<b>出発</b>です。","Departure will be in fifteen minutes."
"1049","発車","depart, leave (for vehicles)","発車[はっしゃ]","Verbal Noun","バスが<b> 発車[はっしゃ]</b>します。","バスが<b>発車</b>します。","The bus is leaving."
"1050","発表","announcement","発表[はっぴょう]","Verbal Noun","合格者[ごうかくしゃ]が<b> 発表[はっぴょう]</b>された。","合格者が<b>発表</b>された。","Those who passed were announced."
"1051","きつい","tight, difficult","きつい","Adjective","このシャツは 少[すこ]し<b>きつい</b>です。","このシャツは少し<b>きつい</b>です。","This shirt is a little tight."
"1052","表現","expression (of views, feelings, etc.)","表現[ひょうげん]","Verbal Noun","彼[かれ]は 歌[うた]で 自分[じぶん]の 気持[きも]ちを<b> 表現[ひょうげん]</b>した。","彼は歌で自分の気持ちを<b>表現</b>した。","He expressed his feelings in song."
"1053","代表","representative","代表[だいひょう]","Verbal Noun","彼[かれ]がクラスの<b> 代表[だいひょう]</b>だ。","彼がクラスの<b>代表</b>だ。","He's the class representative."
"1054","表","front side, face, outside","表[おもて]","Noun","<b> 表[おもて]</b>に 人[ひと]が 来[き]ています。","<b>表</b>に人が来ています。","Someone has come to the door."
"1055","表","list, table","表[ひょう]","Noun","この<b> 表[ひょう]</b>を 見[み]てください。","この<b>表</b>を見てください。","Please look at this chart."
"1056","さっき","some time ago, only a moment ago","さっき","Adverb","<b>さっき</b>の 話[はなし]を 続[つづ]けましょう。","<b>さっき</b>の話を続けましょう。","Let's continue the conversation we had earlier."
"1057","手紙","letter","手紙[てがみ]","Noun","友人[ゆうじん]から<b> 手紙[てがみ]</b>をもらいました。","友人から<b>手紙</b>をもらいました。","I got a letter from a friend."
"1058","絵","picture, painting, drawing","絵[え]","Noun","これは 有名[ゆうめい]な 画家[がか]の<b> 絵[え]</b>です。","これは有名な画家の<b>絵</b>です。","This is a painting by a famous painter."
"1059","雑誌","magazine, journal","雑誌[ざっし]","Noun","この<b> 雑誌[ざっし]</b>はよく 売[う]れています。","この<b>雑誌</b>はよく売れています。","This magazine sells well."
"1060","音","sound, noise","音[おと]","Noun","雨[あめ]の<b> 音[おと]</b>が 聞[き]こえる。","雨の<b>音</b>が聞こえる。","I can hear the sound of rain."
"1061","テキスト","textbook, text file","テキスト","Noun","<b>テキスト</b>を 読[よ]んでください。","<b>テキスト</b>を読んでください。","Please read the textbook."
"1062","音","sound","音[おと]","Noun","このピアノは<b> 音[おと]</b>があまり 良[よ]くない。","このピアノは<b>音</b>があまり良くない。","That piano's sound isn't very good."
"1063","音楽","music","音楽[おんがく]","Noun","私[わたし]は<b> 音楽[おんがく]</b>を 聞[き]くのが 好[す]きだ。","私は<b>音楽</b>を聞くのが好きだ。","I like to listen to music."
"1064","薬","drug, remedy, chemical","薬[くすり]","Noun","この<b> 薬[くすり]</b>を 必[かなら]ず 飲[の]んでください。","この<b>薬</b>を必ず飲んでください。","Please be sure to take this medicine."
"1065","歌","song","歌[うた]","Noun","私[わたし]はその<b> 歌[うた]</b>を 知[し]らなかった。","私はその<b>歌</b>を知らなかった。","I didn't know that song."
"1066","ビニール袋","plastic bag","ビニール 袋[ぶくろ]","Noun","ゴミはその<b>ビニール 袋[ぶくろ]</b>に 入[い]れてください。","ゴミはその<b>ビニール袋</b>に入れてください。","Please put trash in that plastic bag."
