"index","word","meaning","furi","pos","e.g.","e.g.[voc]","e.g.[eng]"
"1514","両方","both","両方[りょうほう]","Noun","チョコレートとケーキを<b> 両方[りょうほう]</b>ください。","チョコレートとケーキを<b>両方</b>ください。","I'll have both the chocolate and the cake, please."
"1515","両替","exchanging currency, break (a 1万 note)","両替[りょうがえ]","Verbal Noun","1万円[いちまんえん]を<b> 両替[りょうがえ]</b>してください。","1万円を<b>両替</b>してください。","Please exchange 10,000 yen for me."
"1516","バスケットボール","basketball","バスケットボール","Noun","姉[あね]は<b>バスケットボール</b>の 選手[せんしゅ]です。","姉は<b>バスケットボール</b>の選手です。","My big sister's a basketball player."
"1517","両親","parents","両親[りょうしん]","Noun","私[わたし]の<b> 両親[りょうしん]</b>は 大阪[おおさか]に 住[す]んでいます。","私の<b>両親</b>は大阪に住んでいます。","My parents live in Osaka."
"1518","片道","one-way","片道[かたみち]","Noun","東京[とうきょう]まで<b> 片道[かたみち]</b> 切符[きっぷ]を 買[か]った。","東京まで<b>片道</b>切符を買った。","I bought a one-way ticket to Tokyo."
"1519","内側","inside, interior","内側[うちがわ]","Noun","白線[はくせん]の<b> 内側[うちがわ]</b>に 下[さ]がってください。","白線の<b>内側</b>に下がってください。","Please step back behind the white line."
"1520","向こう側","other side","向[む]こう 側[がわ]","Noun","私[わたし]の 家[いえ]は 川[かわ]の<b> 向[む]こう 側[がわ]</b>にあります。","私の家は川の<b>向こう側</b>にあります。","My house is on the other side of the river."
"1521","サンドイッチ","sandwich","サンドイッチ","Noun","今日[きょう]のお 昼[ひる]は<b>サンドイッチ</b>です。","今日のお昼は<b>サンドイッチ</b>です。","We're having sandwiches for lunch."
"1522","外側","exterior, outside","外側[そとがわ]","Noun","白線[はくせん]の<b> 外側[そとがわ]</b>を 歩[ある]かないでください。","白線の<b>外側</b>を歩かないでください。","Please don't walk outside the white line."
"1523","左側","left side","左側[ひだりがわ]","Noun","画面[がめん]の<b> 左側[ひだりがわ]</b>を 見[み]てください。","画面の<b>左側</b>を見てください。","Please look at the left side of the screen."
"1524","右側","right side","右側[みぎがわ]","Noun","彼女[かのじょ]はいつも 私[わたし]の<b> 右側[みぎがわ]</b>を 歩[ある]きます。","彼女はいつも私の<b>右側</b>を歩きます。","She always walks on my right."
"1525","裏","rear, reverse (side), inside","裏[うら]","Noun","会社[かいしゃ]の<b> 裏[うら]</b>に 公園[こうえん]があります。","会社の<b>裏</b>に公園があります。","There's a park behind the company."
"1526","にこにこ","smile","にこにこ","Adverb","彼女[かのじょ]はいつも<b>にこにこ</b>しています。","彼女はいつも<b>にこにこ</b>しています。","She's always smiling."
"1527","裏返す","turn over, turn inside out","裏返[うらがえ]す","Verb","彼[かれ]は 紙[かみ]を<b> 裏返[うらがえ]しました</b>。","彼は紙を<b>裏返しました</b>。","He turned the paper over."
"1528","週刊誌","weekly magazine","週刊誌[しゅうかんし]","Noun","その<b> 週刊誌[しゅうかんし]</b>はゴシップばかりだ。","その<b>週刊誌</b>はゴシップばかりだ。","That weekly is full of gossip."
"1529","朝刊","morning edition","朝刊[ちょうかん]","Noun","今日[きょう]の<b> 朝刊[ちょうかん]</b>に 面白[おもしろ]い 記事[きじ]があった。","今日の<b>朝刊</b>に面白い記事があった。","There was an amusing article in today's morning paper."
"1530","夕刊","evening edition","夕刊[ゆうかん]","Noun","そのニュースは<b> 夕刊[ゆうかん]</b>で 見[み]ました。","そのニュースは<b>夕刊</b>で見ました。","I saw that news in the evening newspaper."
"1531","ウール","wool","ウール","Noun","この<b>ウール</b>のセーターは 暖[あたた]かい。","この<b>ウール</b>のセーターは暖かい。","This wool sweater is warm."
"1532","詳しい","detailed, complete","詳[くわ]しい","Adjective","もっと<b> 詳[くわ]しく</b> 説明[せつめい]してください。","もっと<b>詳しく</b>説明してください。","Please explain in greater detail."
"1533","細かい","minute, elaborate","細[こま]かい","Adjective","彼女[かのじょ]は<b> 細[こま]かい</b>ことにうるさい。","彼女は<b>細かい</b>ことにうるさい。","She's fussy about small details."
"1534","細か","minute, elaborate","細[こま]か","Adjectival Noun","それは<b> 細[こま]か</b>な 問題[もんだい]です。","それは<b>細か</b>な問題です。","That's a complex issue."
"1535","積もる","accumulate (snow, dustなど)","積[つ]もる","Verb","雪[ゆき]が<b> 積[つ]もっています</b>。","雪が<b>積もっています</b>。","The snow has settled."
"1536","コーラ","cola, coke","コーラ","Noun","私[わたし]の 兄[あに]は<b>コーラ</b>が 好[す]きだ。","私の兄は<b>コーラ</b>が好きだ。","My older brother likes cola."
"1537","訳","translation","訳[やく]","Noun","その 文[ぶん]の<b> 訳[やく]</b>を 読[よ]みました。","その文の<b>訳</b>を読みました。","I read a translation of that sentence."
"1538","訳す","translate","訳[やく]す","Verb","この 文[ぶん]を<b> 訳[やく]して</b>ください。","この文を<b>訳して</b>ください。","Please translate this sentence."
"1539","検討","consideration, examination","検討[けんとう]","Verbal Noun","今日中[きょう じゅう]にこの 問題[もんだい]を<b> 検討[けんとう]</b>してください。","今日中にこの問題を<b>検討</b>してください。","Please consider this problem by the end of the day."
"1540","塗る","spread on, paint","塗[ぬ]る","Verb","壁[かべ]にペンキを<b> 塗[ぬ]っています</b>。","壁にペンキを<b>塗っています</b>。","I'm painting the wall."
"1541","トイレットペーパー","toilet paper","トイレットペーパー","Noun","<b>トイレットペーパー</b>を 交換[こうかん]しました。","<b>トイレットペーパー</b>を交換しました。","I changed the toilet paper."
"1542","付く","stick to, be attached to, accompany","付[つ]く","Verb","靴[くつ]に 泥[どろ]が<b> 付[つ]いています</b>。","靴に泥が<b>付いています</b>。","I have mud on my shoes."
"1543","付ける","attach, apply (st to st), add","付[つ]ける","Verb","おまけを<b> 付[つ]けました</b>。","おまけを<b>付けました</b>。","I added a freebie."
"1544","受け付ける","accept, receive","受[う]け 付[つ]ける","Verb","郵便物[ゆうびんぶつ]は 5時[ごじ]まで<b> 受[う]け 付[つ]けています</b>。","郵便物は5時まで<b>受け付けています</b>。","We accept mail until five o'clock."
"1545","片付ける","put in order, clear (st) away, put (st) back","片付[かたづ]ける","Verb","早[はや]く 部屋[へや]を<b> 片付[かたづ]けなさい</b>。","早く部屋を<b>片付けなさい</b>。","Hurry up and clean up your room."
"1546","どなた","who (polite)","どなた","Noun","失礼[しつれい]ですが、<b>どなた</b>ですか。","失礼ですが、<b>どなた</b>ですか。","Excuse me, but who are you?"
"1547","受付","receptionist, front desk","受付[うけつけ]","Noun","<b> 受付[うけつけ]</b>は 9時[くじ]からです。","<b>受付</b>は9時からです。","Registration is from nine o'clock."
"1548","近付く","approach, get acquainted","近付[ちかづ]く","Verb","女性[じょせい]が<b> 近付[ちかづ]いて</b>きました。","女性が<b>近付いて</b>きました。","A woman approached me."
"1549","片付く","be in order, be settled","片付[かたづ]く","Verb","仕事[しごと]が 大分[だいぶ]<b> 片付[かたづ]いた</b>。","仕事が大分<b>片付いた</b>。","I've completed a lot of my work."
"1550","気を付ける","take care of, pay attention to","気[き]を 付[つ]ける","Verb","体[からだ]に<b> 気[き]を 付[つ]けて</b>ください。","体に<b>気を付けて</b>ください。","Please take care of yourself."
"1551","ハイキング","hiking","ハイキング","Verbal Noun","昨日[きのう]は 友人[ゆうじん]と<b>ハイキング</b>に 行[い]きました。","昨日は友人と<b>ハイキング</b>に行きました。","I went hiking with a friend yesterday."
"1552","貼る","stick, paste","貼[は]る","Verb","机[つくえ]にシールを<b> 貼[は]った</b>。","机にシールを<b>貼った</b>。","I stuck a sticker on the desk."
"1553","記念日","memorial day, anniversary","記念日[きねんび]","Noun","今日[きょう]は 両親[りょうしん]の 結婚[けっこん]<b> 記念日[きねんび]</b>です。","今日は両親の結婚<b>記念日</b>です。","Today's my parents' wedding anniversary."
"1554","残念","regretful, disappointing","残念[ざんねん]","Adjectival Noun","その 試合[しあい]は<b> 残念[ざんねん]</b>な 結果[けっか]になった。","その試合は<b>残念</b>な結果になった。","The result of the game was disappointing."
"1555","例えば","for example","例[たと]えば","Adverb","<b> 例[たと]えば</b>、このソフトで 日本語[にほんご]を 勉強[べんきょう]することができます。","<b>例えば</b>、このソフトで日本語を勉強することができます。","You can use this software to study Japanese, for example."
"1556","ハム","ham","ハム","Noun","<b>ハム</b>サンドをください。","<b>ハム</b>サンドをください。","Could I have a ham sandwich, please."
"1557","例文","example sentence","例文[れいぶん]","Noun","<b> 例文[れいぶん]</b>を 3[みっ]つ 作[つく]ってください。","<b>例文</b>を3つ作ってください。","Please make three example sentences."
"1558","例","example, precedent","例[れい]","Noun","一[ひと]つ<b> 例[れい]</b>をあげてください。","一つ<b>例</b>をあげてください。","Please give an example."
"1559","余る","remain over, be too much<div>(remain because of excess)</div>","余[あま]る","Verb","夕食[ゆうしょく]の 料理[りょうり]がたくさん<b> 余[あま]った</b>。","夕食の料理がたくさん<b>余った</b>。","A lot of food from dinner was left over."
"1560","除く","exclude, get rid of","除[のぞ]く","Verb","部長[ぶちょう]を<b> 除[のぞ]く</b> 全員[ぜんいん]が 土曜日[どようび]も 働[はたら]いた。","部長を<b>除く</b>全員が土曜日も働いた。","Everyone except the director worked on Saturday."
"1561","ボーイフレンド","boyfriend","ボーイフレンド","Noun","私[わたし]の<b>ボーイフレンド</b>はハンサムな 方[かた]でした。","私の<b>ボーイフレンド</b>はハンサムな方でした。","My boyfriend was a handsome man."
"1562","削る","grind down, trim, scale back","削[けず]る","Verb","彼[かれ]は 家族[かぞく]のために 仕事[しごと]の 時間[じかん]を<b> 削[けず]った</b>。","彼は家族のために仕事の時間を<b>削った</b>。","He reduced his working hours for his family's sake."
"1563","遅刻","tardiness, lateness","遅刻[ちこく]","Verbal Noun","<b> 遅刻[ちこく]</b>しないでください。","<b>遅刻</b>しないでください。","Please don't be late."
"1564","緩い","slack, loose","緩[ゆる]い","Adjective","このズボンは<b> 緩[ゆる]い</b>です。","このズボンは<b>緩い</b>です。","These trousers are loose."
"1565","苦しい","painful, difficult","苦[くる]しい","Adjective","食[た]べ 過[す]ぎておなかが<b> 苦[くる]しい</b>。","食べ過ぎておなかが<b>苦しい</b>。","I have eaten too much and my stomach hurts."
"1566","アイロン","iron","アイロン","Noun","彼女[かのじょ]はシャツに<b>アイロン</b>をかけた。","彼女はシャツに<b>アイロン</b>をかけた。","She ironed the shirt."
"1567","苦い","bitter, sour","苦[にが]い","Adjective","私[わたし]は<b> 苦[にが]い</b>コーヒーが 好[す]きです。","私は<b>苦い</b>コーヒーが好きです。","I like bitter coffee."
"1568","苦手","weak point, (sb) hard to deal with","苦手[にがて]","Adjectival Noun","私[わたし]は 料理[りょうり]が<b> 苦手[にがて]</b>です。","私は料理が<b>苦手</b>です。","I'm not good at cooking."
"1569","困る","be in trouble, have difficulty","困[こま]る","Verb","ケータイをなくして<b> 困[こま]っています</b>。","ケータイをなくして<b>困っています</b>。","I'm in a jam because I lost my cell phone."
"1570","貧乏","poor, poverty","貧乏[びんぼう]","Adjectival Noun","彼[かれ]は 昔[むかし]は<b> 貧乏[びんぼう]</b>だった。","彼は昔は<b>貧乏</b>だった。","He used to be poor."
"1571","カレーライス","curry rice","カレーライス","Noun","子供[こども]は<b>カレーライス</b>が 好[す]きです。","子供は<b>カレーライス</b>が好きです。","Children like curry and rice."
"1572","不幸","unhappiness, misfortune, a death","不幸[ふこう]","Adjectival Noun","彼女[かのじょ]の 家族[かぞく]に<b> 不幸[ふこう]</b>があった。","彼女の家族に<b>不幸</b>があった。","A misfortune befell her family."
"1573","幸せ","happiness, good fortune","幸[しあわ]せ","Adjectival Noun","良[い]い 友達[ともだち]がいて 私[わたし]は<b> 幸[しあわ]せ</b>だ。","良い友達がいて私は<b>幸せ</b>だ。","I'm happy to have good friends."
"1574","塩","salt","塩[しお]","Noun","もうちょっと<b> 塩[しお]</b>を 入[い]れて。","もうちょっと<b>塩</b>を入れて。","Put in a little more salt."
"1575","塩辛い","salty","塩辛[しおから]い","Adjective","海[うみ]の 水[みず]は<b> 塩辛[しおから]い</b>。","海の水は<b>塩辛い</b>。","Sea water is salty."
"1576","キャッシュカード","ATM card","キャッシュカード","Noun","<b>キャッシュカード</b>でお 金[かね]を 下[お]ろした。","<b>キャッシュカード</b>でお金を下ろした。","I took out some money with my ATM card."
"1577","砂糖","sugar","砂糖[さとう]","Noun","コーヒーに<b> 砂糖[さとう]</b>は 入[い]れますか。","コーヒーに<b>砂糖</b>は入れますか。","Do you take sugar in your coffee?"
"1578","規模","scale (big, smallなど), scope","規模[きぼ]","Noun","この 動物園[どうぶつえん]は 日本一[にっぽんいち]の<b> 規模[きぼ]</b>です。","この動物園は日本一の<b>規模</b>です。","This is the largest zoo in Japan."
"1579","農業","agriculture","農業[のうぎょう]","Noun","私[わたし]は<b> 農業[のうぎょう]</b>を 勉強[べんきょう]しています。","私は<b>農業</b>を勉強しています。","I'm studying agriculture."
"1580","濃い","thick, concentrated, dark-colored","濃[こ]い","Adjective","私[わたし]は<b> 濃[こ]い</b> 味[あじ]が 好[す]きだ。","私は<b>濃い</b>味が好きだ。","I like strong tastes."
"1581","イヤリング","earrings","イヤリング","Noun","彼女[かのじょ]はすてきな<b>イヤリング</b>をしている。","彼女はすてきな<b>イヤリング</b>をしている。","She's wearing wonderful earrings."
"1582","薄い","thin, weak, pale","薄[うす]い","Adjective","この 電子辞書[でんし じしょ]はとても<b> 薄[うす]い</b>。","この電子辞書はとても<b>薄い</b>。","This electronic dictionary is very thin."
"1583","厚い","thick, bulky","厚[あつ]い","Adjective","その 辞書[じしょ]はとても<b> 厚[あつ]い</b>。","その辞書はとても<b>厚い</b>。","That dictionary is very thick."
"1584","厚さ","thickness","厚[あつ]さ","Noun","私[わたし]は 板[いた]の<b> 厚[あつ]さ</b>を 測[はか]った。","私は板の<b>厚さ</b>を測った。","I measured the thickness of the board."
"1585","迫る","<!--anki-->approach, draw near,&nbsp;press (sb for st)","迫[せま]る","Verb","締[し]め 切[き]りが<b> 迫[せま]っています</b>。","締め切りが<b>迫っています</b>。","The deadline is approaching."
"1586","ガールフレンド","girlfriend","ガールフレンド","Noun","昔[むかし]は 彼女[かのじょ]のことを<b>ガールフレンド</b>と 言[い]っていました。","昔は彼女のことを<b>ガールフレンド</b>と言っていました。","""We used to call girlfriends """"garufurendo."""""""
"1587","伸びる","get longer, grow, stretch","伸[の]びる","Verb","髪[かみ]がだいぶ<b> 伸[の]びた</b>ね。","髪がだいぶ<b>伸びた</b>ね。","Your hair has grown a lot, hasn't it?"
"1588","引っ越す","move (houses)","引[ひ]っ 越[こ]す","Verb","来月[らいげつ]、 大阪[おおさか]に<b> 引[ひ]っ 越[こ]します</b>。","来月、大阪に<b>引っ越します</b>。","I'll move to Osaka next month."
"1589","越える","go over, go across, go beyond","越[こ]える","Verb","私[わたし]たちは 高[たか]い 山[やま]を<b> 越[こ]えました</b>。","私たちは高い山を<b>越えました</b>。","We went over a tall mountain."
"1590","引っ越し","moving (houses)","引[ひ]っ 越[こ]し","Verbal Noun","去年[きょねん]、<b> 引[ひ]っ 越[こ]し</b>しました。","去年、<b>引っ越し</b>しました。","I moved last year."
"1591","カセットテープ","cassette tape","カセットテープ","Noun","昔[むかし]は<b>カセットテープ</b>を 使[つか]っていました。","昔は<b>カセットテープ</b>を使っていました。","I used to use cassette tapes along time ago."
"1592","追い越す","pass, outdo","追[お]い 越[こ]す","Verb","大[おお]きなトラックが 私[わたし]たちを<b> 追[お]い 越[こ]した</b>。","大きなトラックが私たちを<b>追い越した</b>。","A big truck overtook us."
"1593","上昇","a rise, an increase","上昇[じょうしょう]","Verbal Noun","地球[ちきゅう]の 気温[きおん]は<b> 上昇[じょうしょう]</b>している。","地球の気温は<b>上昇</b>している。","The temperature of the earth is rising."
"1594","改札口","ticket barrier","改札口[かいさつぐち]","Noun","<b> 改札口[かいさつぐち]</b>で 会[あ]いましょう。","<b>改札口</b>で会いましょう。","Let's meet at the ticket gate."
"1595","失礼","impoliteness, bad manners, I beg your parden/Goodbye","失礼[しつれい]","Verbal Noun","ではそろそろ<b> 失礼[しつれい]</b>します。","ではそろそろ<b>失礼</b>します。","Well, it's about time for me to go."
"1596","かゆい","itchy","かゆい","Adjective","背中[せなか]が<b>かゆい</b>です。","背中が<b>かゆい</b>です。","My back itches."
"1597","お礼","thanks, reward, return present","お 礼[れい]","Verbal Noun","彼女[かのじょ]に<b>お 礼[れい]</b>の 手紙[てがみ]を 書[か]きました。","彼女に<b>お礼</b>の手紙を書きました。","I wrote her a thank you letter."
"1598","謝る","apologize","謝[あやま]る","Verb","彼[かれ]は 直[す]ぐに<b> 謝[あやま]りました</b>。","彼は直ぐに<b>謝りました</b>。","He apologized at once."
"1599","注射","shot, injection","注射[ちゅうしゃ]","Verbal Noun","彼[かれ]は<b> 注射[ちゅうしゃ]</b>があまり 好[す]きではありません。","彼は<b>注射</b>があまり好きではありません。","He's not too fond of getting shots."
"1600","程度","degree, extent","程度[ていど]","Noun","この<b> 程度[ていど]</b>の 怪我[けが]なら 大丈夫[だいじょうぶ]です。","この<b>程度</b>の怪我なら大丈夫です。","With an injury of this small extent, she's going to be fine."
"1601","ぐらぐら","wobble","ぐらぐら","Adverb","地震[じしん]で 家[いえ]が<b>ぐらぐら</b>と 揺[ゆ]れた。","地震で家が<b>ぐらぐら</b>と揺れた。","The house shook because of the earthquake."
"1602","誘う","invite, ask out","誘[さそ]う","Verb","彼女[かのじょ]をデートに<b> 誘[さそ]った</b>。","彼女をデートに<b>誘った</b>。","I asked her out on a date."
"1603","導入","introduction, bringing in","導入[どうにゅう]","Verbal Noun","会社[かいしゃ]で 新[あたら]しいシステムを<b> 導入[どうにゅう]</b>した。","会社で新しいシステムを<b>導入</b>した。","A new system was introduced in the company."
"1604","努力","<!--anki-->effort,&nbsp;endeavor","努力[どりょく]","Verbal Noun","もっと<b> 努力[どりょく]</b>しよう。","もっと<b>努力</b>しよう。","Let's try harder."
"1605","怒る","get angry, scold","怒[おこ]る","Verb","彼女[かのじょ]が 嘘[うそ]をついたので、 彼[かれ]は<b> 怒[おこ]った</b>。","彼女が嘘をついたので、彼は<b>怒った</b>。","He was angry because she lied to him."
"1606","ジャム","jam","ジャム","Noun","このイチゴで<b>ジャム</b>を 作[つく]りましょう。","このイチゴで<b>ジャム</b>を作りましょう。","Let's make jam from these strawberries."
"1607","独身","single, unmarried","独身[どくしん]","Noun","私[わたし]の 兄[あに]はまだ<b> 独身[どくしん]</b>です。","私の兄はまだ<b>独身</b>です。","My big brother's still single."
"1608","占める","occupy, hold","占[し]める","Verb","私[わたし]に 届[とど]くメールのうち、 迷惑[めいわく]メールが 7割[ななわり]を<b> 占[し]めている</b>。","私に届くメールのうち、迷惑メールが7割を<b>占めている</b>。","About 70 percent of emails sent to me are junk."
"1609","処理","processing,&nbsp;management<div>(unlike 加工, a new thing is not created)</div>","処理[しょり]","Verbal Noun","事務的[じむてき]な<b> 処理[しょり]</b>に 1週間[いっしゅうかん]かかります。","事務的な<b>処理</b>に1週間かかります。","The administrative processing takes one week."
"1610","紹介","introduction, presentation","紹介[しょうかい]","Verbal Noun","両親[りょうしん]に 彼女[かのじょ]を<b> 紹介[しょうかい]</b>した。","両親に彼女を<b>紹介</b>した。","I introduced my girlfriend to my parents."
"1611","スリッパ","slippers","スリッパ","Noun","<b>スリッパ</b>をはいてください。","<b>スリッパ</b>をはいてください。","Wear slippers please."
"1612","招く","invite, beckon","招[まね]く","Verb","両親[りょうしん]を 食事[しょくじ]に<b> 招[まね]いた</b>。","両親を食事に<b>招いた</b>。","I invited my parents to a meal."
"1613","招待","invitation","招待[しょうたい]","Verbal Noun","高校[こうこう]の 時[とき]の 先生[せんせい]を 結婚式[けっこんしき]に<b> 招待[しょうたい]</b>した。","高校の時の先生を結婚式に<b>招待</b>した。","I invited my high school teacher to the wedding."
"1614","夫婦","husband and wife, married couple","夫婦[ふうふ]","Noun","その<b> 夫婦[ふうふ]</b>はとても 仲[なか]がいい。","その<b>夫婦</b>はとても仲がいい。","That couple gets on very well."
"1615","奥","inner part, the back, inner chamber","奥[おく]","Noun","はさみは 机[つくえ]の<b> 奥[おく]</b>にあった。","はさみは机の<b>奥</b>にあった。","The scissors were at the back of the desk."
"1616","トランプ","(a pack of) cards, (playing) cards","トランプ","Verbal Noun","友達[ともだち]と<b>トランプ</b>をして 遊[あそ]びました。","友達と<b>トランプ</b>をして遊びました。","I played cards with a friend."
"1617","奥さん","(sb's) wife,&nbsp;married lady","奥[おく]さん","Noun","彼[かれ]の<b> 奥[おく]さん</b>はきれいな 方[かた]です。","彼の<b>奥さん</b>はきれいな方です。","His wife is beautiful."
"1618","皆さん","everybody (丁寧語)","皆[みな]さん","Noun","<b> 皆[みな]さん</b>にお 話[はなし]があります。","<b>皆さん</b>にお話があります。","I have something to say to everybody."
"1619","皆様","everyone (敬語)","皆様[みなさま]","Noun","<b> 皆様[みなさま]</b>、こんにちは。","<b>皆様</b>、こんにちは。","Hello everyone."
"1620","誰か","someone","誰[だれ]か","Noun","<b> 誰[だれ]か</b>に 聞[き]いてみてください。","<b>誰か</b>に聞いてみてください。","Please ask someone."
"1621","よろしい","all right (いいの改まった言い方)","よろしい","Adjective","レポートはこれで<b>よろしい</b>ですか。","レポートはこれで<b>よろしい</b>ですか。","Is this all right as a report?"
"1622","国籍","citizenship, nationality","国籍[こくせき]","Noun","私[わたし]は 日本[にほん]<b> 国籍[こくせき]</b>です。","私は日本<b>国籍</b>です。","I'm a Japanese citizen."
