"index","word","meaning","furi","pos","e.g.","e.g.[voc]","e.g.[eng]"
"501","サービス","service, on the house","サービス","Verbal Noun","この 店[みせ]は<b>サービス</b>がいい。","この店は<b>サービス</b>がいい。","The service in this store is good."
"502","女の子","girl, baby girl","女[おんな]の 子[こ]","Noun","あの<b> 女[おんな]の 子[こ]</b>を 知[し]っていますか。","あの<b>女の子</b>を知っていますか。","Do you know that girl?"
"503","男の子","boy, baby boy","男[おとこ]の 子[こ]","Noun","<b> 男[おとこ]の 子[こ]</b>たちがサッカーをしている。","<b>男の子</b>たちがサッカーをしている。","The boys are playing soccer."
"504","私たち","we","私[わたし]たち","Noun","<b> 私[わたし]たち</b>は 来月結婚[らいげつ けっこん]します。","<b>私たち</b>は来月結婚します。","We will get married next month."
"505","達する","attain, reach","達[たっ]する","Verb","気温[きおん]は 35度[さんじゅうごど]に<b> 達[たっ]した</b>。","気温は35度に<b>達した</b>。","The temperature reached 35 degrees."
"506","グループ","group","グループ","Noun","店[みせ]に 学生[がくせい]の<b>グループ</b>が 来[き]た。","店に学生の<b>グループ</b>が来た。","A group of students came to the shop."
"507","家","house, home","家[いえ]","Noun","ここが 私[わたし]の<b> 家[いえ]</b>です。","ここが私の<b>家</b>です。","This is my house."
"508","家内","my wife","家内[かない]","Noun","<b> 家内[かない]</b>は 九州出身[きゅうしゅう しゅっしん]です。","<b>家内</b>は九州出身です。","My wife is from Kyushu."
"509","客","visitor, customer","客[きゃく]","Noun","その 店[みせ]は 若[わか]い<b> 客[きゃく]</b>が 多[おお]いです。","その店は若い<b>客</b>が多いです。","That shop has a lot of young customers."
"510","空気","air, atmosphere","空気[くうき]","Noun","ここは<b> 空気[くうき]</b>がきれいです。","ここは<b>空気</b>がきれいです。","The air here is clean."
"511","ホテル","hotel","ホテル","Noun","今[いま]<b>ホテル</b>に 着[つ]きました。","今<b>ホテル</b>に着きました。","I arrived at the hotel just now."
"512","気に入る","like, be pleased with","気[き]に 入[い]る","Verb","新[あたら]しい 靴[くつ]がとても<b> 気[き]に 入[い]りました</b>。","新しい靴がとても<b>気に入りました</b>。","I really like my new shoes."
"513","人気","popularity","人気[にんき]","Noun","このバンドはとても<b> 人気[にんき]</b>があるよ。","このバンドはとても<b>人気</b>があるよ。","That band is very popular."
"514","雨","rain","雨[あめ]","Noun","<b> 雨[あめ]</b>が 降[ふ]っています。","<b>雨</b>が降っています。","It's raining."
"515","雪","snow, snowfall","雪[ゆき]","Noun","クリスマスに<b> 雪[ゆき]</b>が 降[ふ]りました。","クリスマスに<b>雪</b>が降りました。","It snowed at Christmas."
"516","まとめる","gather together, summarize","まとめる","Verb","彼女[かのじょ]は 荷物[にもつ]を<b>まとめて</b> 出[で]て 行[い]った。","彼女は荷物を<b>まとめて</b>出て行った。","She packed her luggage and left."
"517","青い","blue","青[あお]い","Adjective","ここの 海[うみ]はとても<b> 青[あお]い</b>。","ここの海はとても<b>青い</b>。","The sea here is very blue."
"518","青","blue, green, green light","青[あお]","Noun","私[わたし]の 好[す]きな 色[いろ]は<b> 青[あお]</b>です。","私の好きな色は<b>青</b>です。","My favorite color is blue."
"519","晴れ","fine weather, clear sky","晴[は]れ","Noun","明日[あす]の 天気[てんき]は<b> 晴[は]れ</b>です。","明日の天気は<b>晴れ</b>です。","Tomorrow's weather will be sunny."
"520","明らか","clear, obvious","明[あき]らか","Adjective","<b> 明[あき]らか</b>に 彼[かれ]が 悪[わる]い。","<b>明らか</b>に彼が悪い。","It's clearly his fault."
"521","やはり","as expected, also, still","やはり","Adverb","彼[かれ]は<b>やはり</b> 遅刻[ちこく]しました。","彼は<b>やはり</b>遅刻しました。","He was late, as expected."
"522","明るい","bright, cheerful","明[あか]るい","Adjective","彼女[かのじょ]は<b> 明[あか]るい</b> 性格[せいかく]です。","彼女は<b>明るい</b>性格です。","She has a cheerful personality."
"523","明日","tomorrow","明日[あした]","Noun","<b> 明日[あした]</b>、 会社[かいしゃ]を 休[やす]みます。","<b>明日</b>、会社を休みます。","I'm off work tomorrow."
"524","暗い","dark, dreary, shadowy","暗[くら]い","Adjective","東[ひがし]の 空[そら]が<b> 暗[くら]い</b>です。","東の空が<b>暗い</b>です。","The eastern sky is dark."
"525","昨年","last year (polite)","昨年[さくねん]","Noun","<b> 昨年[さくねん]</b>は 地震[じしん]が 多[おお]い 年[とし]でした。","<b>昨年</b>は地震が多い年でした。","Last year there were a lot of earthquakes."
"526","はっきり","clearly, distinctly","はっきり","Adverb","今日[きょう]は 山[やま]が<b>はっきり</b> 見[み]える。","今日は山が<b>はっきり</b>見える。","You can see the mountains clearly today."
"527","一昨年","the year before last","一昨年[おととし]","Noun","<b> 一昨年[おととし]</b> 初[はじ]めて 京都[きょうと]へ 旅行[りょこう]しました。","<b>一昨年</b>初めて京都へ旅行しました。","I first traveled to Kyoto the year before last."
"528","一昨日","day before yesterday","一昨日[おととい]","Noun","<b> 一昨日[おととい]</b> 彼[かれ]から 電話[でんわ]がありました。","<b>一昨日</b>彼から電話がありました。","There was a phone call from him the day before yesterday."
"529","東","east, eastern","東[ひがし]","Noun","<b> 東[ひがし]</b>の 空[そら]が 暗[くら]いです。","<b>東</b>の空が暗いです。","The eastern sky is dark."
"530","西","west, western","西[にし]","Noun","太陽[たいよう]は<b> 西[にし]</b>に 沈[しず]みます。","太陽は<b>西</b>に沈みます。","The sun sets in the west."
"531","つまり","in short, basically","つまり","Adverb","<b>つまり</b>、あなたは 何[なに]も 知[し]らないのですね。","<b>つまり</b>、あなたは何も知らないのですね。","So, basically, you don't know anything."
"532","南","south","南[みなみ]","Noun","私[わたし]の 家[いえ]は 町[まち]の<b> 南[みなみ]</b>にあります。","私の家は町の<b>南</b>にあります。","My house is in the south of the town."
"533","北","north","北[きた]","Noun","ロシアは 日本[にっぽん]の<b> 北[きた]</b>にあります。","ロシアは日本の<b>北</b>にあります。","Russia is north of Japan."
"534","方向","direction, course","方向[ほうこう]","Noun","あの 人[ひと]たちは 皆[みな]、 同[おな]じ<b> 方向[ほうこう]</b>を 見[み]ている。","あの人たちは皆、同じ<b>方向</b>を見ている。","Those people are all looking in the same direction."
"535","向かう","face, head toward, confront","向[む]かう","Verb","今[いま]、 会社[かいしゃ]に<b> 向[む]かっています</b>。","今、会社に<b>向かっています</b>。","I'm heading for the office right now."
"536","ビル","building (ローマ字)","ビル","Noun","私[わたし]の 会社[かいしゃ]はあの<b>ビル</b>の 8階[はちかい]です。","私の会社はあの<b>ビル</b>の8階です。","My company's on the eighth floor of that building."
"537","向こう","the other side, the other party, opponent","向[む]こう","Noun","友達[ともだち]は<b> 向[む]こう</b>にいます。","友達は<b>向こう</b>にいます。","My friend is over there."
"538","向く","turn, face, look","向[む]く","Verb","こっちを<b> 向[む]いて</b>ください。","こっちを<b>向いて</b>ください。","Please turn this way."
"539","開く","open が","開[あ]く","Verb","電車[でんしゃ]のドアが<b> 開[あ]きました</b>。","電車のドアが<b>開きました</b>。","The train door opened."
"540","聞こえる","be heard, be audible","聞[き]こえる","Verb","隣[となり]の 部屋[へや]からテレビの 音[おと]が<b> 聞[き]こえる</b>。","隣の部屋からテレビの音が<b>聞こえる</b>。","I can hear the sound of the television from the next room."
"541","もちろん","of course, needless to say","もちろん","Adverb","<b>もちろん</b> 一緒[いっしょ]に 行[い]きます。","<b>もちろん</b>一緒に行きます。","Of course I'll go with you."
"542","年間","period of one year","年間[ねんかん]","Noun","<b> 年間[ねんかん]</b> 5万人[ごまんにん]がここを 訪[おとず]れます。","<b>年間</b>5万人がここを訪れます。","This place gets 50,000 visitors a year."
"543","この間","the other day, recently","この 間[あいだ]","Noun","<b>この 間[あいだ]</b> 彼女[かのじょ]に 会[あ]った。","<b>この間</b>彼女に会った。","I met her the other day."
"544","間","interval, space between","間[あいだ]","Noun","雲[くも]の<b> 間[あいだ]</b>から 月[つき]が 出[で]た。","雲の<b>間</b>から月が出た。","The moon came out from between the clouds."
"545","人間","human being, people","人間[にんげん]","Noun","<b> 人間[にんげん]</b>の 心[こころ]は 複雑[ふくざつ]です。","<b>人間</b>の心は複雑です。","Man's mind is complex."
"546","かつて","once, formerly","かつて","Adverb","<b>かつて</b> 私[わたし]が 学生[がくせい]だった 頃[ころ]のことです。","<b>かつて</b>私が学生だった頃のことです。","That was when I was still a student."
"547","高さ","height","高[たか]さ","Noun","富士山[ふじさん]の<b> 高[たか]さ</b>は 3,776[さんぜんななひゃく-ななじゅうろく]メートルです。","富士山の<b>高さ</b>は3,776メートルです。","The height of Mt. Fuji is 3,776m."
"548","最大","biggest, largest","最大[さいだい]","Noun","これは 世界[せかい]<b> 最大[さいだい]</b>の 船[ふね]です。","これは世界<b>最大</b>の船です。","This is the world's largest ship."
"549","初めて","first, for the first time","初[はじ]めて","Adverb","東京[とうきょう]に 来[く]るのは<b> 初[はじ]めて</b>です。","東京に来るのは<b>初めて</b>です。","It's the first time I've been to Tokyo."
"550","最初","the beginning, first","最初[さいしょ]","Noun","5[ご]ページの<b> 最初[さいしょ]</b>を 見[み]てください。","5ページの<b>最初</b>を見てください。","Please look at the beginning of page 5."
"551","スポーツ","sport","スポーツ","Noun","あなたは 何[なに]か<b>スポーツ</b>をしていますか。","あなたは何か<b>スポーツ</b>をしていますか。","Which sport do you play?"
"552","初め","beginning, start","初[はじ]め","Noun","<b> 初[はじ]め</b>は 上手[うま]くできませんでした。","<b>初め</b>は上手くできませんでした。","I couldn't do it well at first."
"553","今後","after this, in the future (formal)","今後[こんご]","Noun","<b> 今後[こんご]</b>ともよろしくお 願[ねが]いします。","<b>今後</b>ともよろしくお願いします。","I look forward to working with you in the future."
"554","後[のち]","after, afterwards (formal)","後[のち]","Noun","<b> 後[のち]</b>に 彼[かれ]は 総理大臣[そうり だいじん]になりました。","<b>後[のち]</b>に彼は総理大臣になりました。","He would later become Prime Minister."
"555","最後","last, final","最後[さいご]","Noun","今日[きょう]が 夏休[なつやす]み<b> 最後[さいご]</b>の 日[ひ]だ。","今日が夏休み<b>最後</b>の日だ。","Today's the last day of summer vacation."
"556","なぜ","why, for what reason","なぜ","Adverb","<b>なぜ</b> 来[こ]なかったの。","<b>なぜ</b>来なかったの。","Why didn't you come?"
"557","明後日","day after tomorrow","明後日[あさって]","Noun","<b> 明後日[あさって]</b>は 休日[きゅうじつ]です。","<b>明後日</b>は休日です。","The day after tomorrow's a holiday."
"558","牛","cattle, cow","牛[うし]","Noun","<b> 牛[うし]</b>が 草[くさ]を 食[た]べています。","<b>牛</b>が草を食べています。","The cow is eating grass."
"559","半分","half","半分[はんぶん]","Noun","お 菓子[かし]を 友達[ともだち]に<b> 半分[はんぶん]</b>あげた。","お菓子を友達に<b>半分</b>あげた。","I gave half the sweets to a friend."
"560","半年","half a year","半年[はんとし]","Noun","日本[にっぽん]に 来[き]て<b> 半年[はんとし]</b>になります。","日本に来て<b>半年</b>になります。","It has been half a year since I came to Japan."
"561","そのまま","like that, unchanged","そのまま","Adverb","<b>そのまま</b>お 待[ま]ちください。","<b>そのまま</b>お待ちください。","Please just wait a bit."
"562","半月","half a month","半月[はんつき]","Noun","<b> 半月[はんつき]</b> 前[まえ]に 日本[にほん]に 来[き]ました。","<b>半月</b>前に日本に来ました。","I came to Japan half a month ago."
"563","半日","half a day","半日[はんにち]","Noun","今日[きょう]は<b> 半日[はんにち]</b>だけ 仕事[しごと]だ。","今日は<b>半日</b>だけ仕事だ。","I'm working only a half-day today."
"564","毎朝","every morning","毎朝[まいあさ]","Noun","私[わたし]は<b> 毎朝[まいあさ]</b>ジョギングをします。","私は<b>毎朝</b>ジョギングをします。","I jog every morning."
"565","今朝","this morning","今朝[けさ]","Noun","<b> 今朝[けさ]</b>から 頭[あたま]が 痛[いた]い。","<b>今朝</b>から頭が痛い。","I've had a headache since this morning."
"566","もし","if, in case of","もし","Adverb","<b>もし</b> 雨[あめ]が 降[ふ]ったら、 行[い]きません。","<b>もし</b>雨が降ったら、行きません。","I won't go if it rains."
"567","昼休み","noon recess, lunch break","昼休[ひるやす]み","Noun","<b> 昼休[ひるやす]み</b>に 公園[こうえん]に 行[い]った。","<b>昼休み</b>に公園に行った。","I went to the park at lunchtime."
"568","昼前","in the morning, before noon","昼前[ひるまえ]","Noun","<b> 昼前[ひるまえ]</b>に 会議[かいぎ]があった。","<b>昼前</b>に会議があった。","There was a meeting in the morning."
"569","昼間","daytime, day","昼間[ひるま]","Noun","<b> 昼間[ひるま]</b>は 仕事[しごと]で 忙[いそが]しいです。","<b>昼間</b>は仕事で忙しいです。","I'm busy with work in the daytime."
"570","毎晩","every evening","毎晩[まいばん]","Noun","姉[あね]は<b> 毎晩[まいばん]</b> 日記[にっき]を 書[か]いています。","姉は<b>毎晩</b>日記を書いています。","My older sister writes in her diary every evening."
"571","つもり","intention, plan","つもり","Noun","明日[あした]からタバコを 止[や]める<b>つもり</b>です。","明日からタバコを止める<b>つもり</b>です。","I'll stop smoking as of tomorrow."
"572","今夜","tonight, this evening","今夜[こんや]","Noun","<b> 今夜[こんや]</b>は 月[つき]がとてもきれいです。","<b>今夜</b>は月がとてもきれいです。","The moon is very beautiful tonight."
"573","昨夜","last night, last evening","昨夜[ゆうべ]","Noun","<b> 昨夜[ゆうべ]</b>、 流[なが]れ 星[ぼし]を 見[み]ました。","<b>昨夜</b>、流れ星を見ました。","I saw some shooting stars last night."
"574","夜中","midnight, dead of night","夜中[よなか]","Noun","<b> 夜中[よなか]</b>に 電話[でんわ]がありました。","<b>夜中</b>に電話がありました。","I got a telephone call in the middle of the night."
"575","夕方","evening","夕方[ゆうがた]","Noun","<b> 夕方[ゆうがた]</b>そちらに 着[つ]きます。","<b>夕方</b>そちらに着きます。","I'll arrive there in the evening."
"576","やっと","at last, finally (exclamation)","やっと","Adverb","<b>やっと</b> 仕事[しごと]が 終[お]わりました。","<b>やっと</b>仕事が終わりました。","Finally, I finished my work."
"577","昼食","lunch (formal)","昼食[ちゅうしょく]","Noun","<b> 昼食[ちゅうしょく]</b>に 寿司[すし]を 食[た]べました。","<b>昼食</b>に寿司を食べました。","I ate sushi for lunch."
"578","朝食","breakfast (formal)","朝食[ちょうしょく]","Noun","<b> 朝食[ちょうしょく]</b>に 納豆[なっとう]を 食[た]べました。","<b>朝食</b>に納豆を食べました。","I ate natto for breakfast."
"579","夕食","supper (polite)","夕食[ゆうしょく]","Noun","<b> 夕食[ゆうしょく]</b>は 7時[しちじ]です。","<b>夕食</b>は7時です。","Dinner's at seven o'clock."
"580","夕飯","evening meal, supper (かたい)","夕飯[ゆうはん]","Noun","<b> 夕飯[ゆうはん]</b>は 寿司[すし]でした。","<b>夕飯</b>は寿司でした。","Dinner was sushi."
"581","ニュース","news","ニュース","Noun","夜[よる]の<b>ニュース</b>を 見[み]ましたか。","夜の<b>ニュース</b>を見ましたか。","Did you see the evening news?"
"582","見方","view, way of looking","見方[みかた]","Noun","彼[かれ]に 対[たい]する<b> 見方[みかた]</b>が 変[か]わりました。","彼に対する<b>見方</b>が変わりました。","My view of him has changed."
"583","花見","cherry blossom viewing","花見[はなみ]","Noun","友達[ともだち]と<b> 花見[はなみ]</b>をしました。","友達と<b>花見</b>をしました。","I went cherry blossom viewing with a friend."
"584","言い方","way of speaking, expression","言[い]い 方[かた]","Noun","そんな<b> 言[い]い 方[かた]</b>をしてはいけません。","そんな<b>言い方</b>をしてはいけません。","You mustn't talk like that."
"585","話","talk, story","話[はなし]","Noun","あなたの<b> 話[はなし]</b>は 面白[おもしろ]いね。","あなたの<b>話</b>は面白いね。","Your story's interesting."
"586","ずっと","the whole time, from start to finish","ずっと","Adverb","父[ちち]は 休[やす]みの 日[ひ]は<b>ずっと</b>テレビを 見[み]ている。","父は休みの日は<b>ずっと</b>テレビを見ている。","My father spends his days off watching television all the time."
"587","読み","reading, judgment, foresight","読[よ]み","Noun","母[はは]に<b> 読[よ]み</b> 書[か]きを 習[なら]いました。","母に<b>読み</b>書きを習いました。","I learned reading and writing from my mother."
"588","読み方","way to read, reading","読[よ]み 方[かた]","Noun","この 漢字[かんじ]の<b> 読[よ]み 方[かた]</b>を 教[おし]えてください。","この漢字の<b>読み方</b>を教えてください。","Please tell me how to read this Chinese character."
"589","語る","tell (a story), talk about","語[かた]る","Verb","今夜[こんや]は 大[おお]いに<b> 語[かた]りましょう</b>。","今夜は大いに<b>語りましょう</b>。","Let's talk about everything tonight."
"590","言語","language, speech","言語[げんご]","Noun","彼[かれ]はアジアの<b> 言語[げんご]</b>を 研究[けんきゅう]している。","彼はアジアの<b>言語</b>を研究している。","He's doing research in Asian languages."
"591","ビデオ","video","ビデオ","Noun","私[わたし]はその 番組[ばんぐみ]を<b>ビデオ</b>に 撮[と]った。","私はその番組を<b>ビデオ</b>に撮った。","I recorded that program on video."
"592","英語","English","英語[えいご]","Noun","あなたは<b> 英語[えいご]</b>が 話[はな]せますか。","あなたは<b>英語</b>が話せますか。","Can you speak English?"
"593","文字","character, letter","文字[もじ]","Noun","壁[かべ]に<b> 文字[もじ]</b>が 書[か]いてあった。","壁に<b>文字</b>が書いてあった。","There was some writing on the wall."
"594","ローマ字","Roman alphabet","ローマ 字[じ]","Noun","<b>ローマ 字[じ]</b>で 名前[なまえ]を 書[か]いてください。","<b>ローマ字</b>で名前を書いてください。","Please write your name using Roman letters."
"595","字","character, letter, handwriting","字[じ]","Noun","もっと 大[おお]きく<b> 字[じ]</b>を 書[か]いてください。","もっと大きく<b>字</b>を書いてください。","Please write the letters larger."
"596","マンション","(modern) apartment complex","マンション","Noun","彼[かれ]は<b>マンション</b>に 住[す]んでいます。","彼は<b>マンション</b>に住んでいます。","He lives in an apartment."
"597","書き方","how to write, way of writing","書[か]き 方[かた]","Noun","彼[かれ]はその 漢字[かんじ]の<b> 書[か]き 方[かた]</b>が 分[わ]からない。","彼はその漢字の<b>書き方</b>が分からない。","He doesn't know how to write that Chinese character."
"598","覚める","awake, wake up (目が)","覚[さ]める","Verb","今朝[けさ]は 6時[ろくじ]に 目[め]が<b> 覚[さ]めた</b>。","今朝は6時に目が<b>覚めた</b>。","I woke up at six o'clock this morning."
"599","覚ます","awaken, wake up 目を","覚[さ]ます","Verb","子供[こども]が 目[め]を<b> 覚[さ]ました</b>。","子供が目を<b>覚ました</b>。","The child woke up."
"600","大会","mass meeting, tournament","大会[たいかい]","Noun","夏[なつ]には 川辺[かわべ]で 花火[はなび]<b> 大会[たいかい]</b>があります。","夏には川辺で花火<b>大会</b>があります。","There are fireworks by the river in summer."
"601","しばらく","a short while, long time, for the time being","しばらく","Adverb","そこで<b>しばらく</b> 休[やす]んでいます。","そこで<b>しばらく</b>休んでいます。","He's resting over there for a while."
"602","会話","conversation","会話[かいわ]","Verbal Noun","親子[おやこ]の<b> 会話[かいわ]</b>は 大切[たいせつ]です。","親子の<b>会話</b>は大切です。","Conversation between parents and children is important."
"603","話し合う","discuss, talk about","話[はな]し 合[あ]う","Verb","私[わたし]たちはよく<b> 話[はな]し 合[あ]いました</b>。","私たちはよく<b>話し合いました</b>。","We often talked to each other."
"604","合う","fit","合[あ]う","Verb","この 靴[くつ]は 私[わたし]の 足[あし]に<b> 合[あ]っている</b>。","この靴は私の足に<b>合っている</b>。","These shoes fit me."
"605","間に合う","be in time, serve (my) purpose<br>なくても〜 do without","間[ま]に 合[あ]う","Verb","授業[じゅぎょう]に<b> 間[ま]に 合[あ]いました</b>。","授業に<b>間に合いました</b>。","I made it in time for class."
"606","ガス","gas","ガス","Noun","地震[じしん]で<b>ガス</b>が 止[と]まった。","地震で<b>ガス</b>が止まった。","The gas got cut off due to the earthquake."
"607","会社","company, corporation","会社[かいしゃ]","Noun","彼[かれ]は 小[ちい]さな<b> 会社[かいしゃ]</b>に 勤[つと]めています。","彼は小さな<b>会社</b>に勤めています。","He's working for a small business firm."
"608","社会","society","社会[しゃかい]","Noun","これは 大[おお]きな<b> 社会[しゃかい]</b> 問題[もんだい]になっている。","これは大きな<b>社会</b>問題になっている。","This is a major social issue."
"609","社員","staff member, employee","社員[しゃいん]","Noun","彼[かれ]は 優秀[ゆうしゅう]な<b> 社員[しゃいん]</b>です。","彼は優秀な<b>社員</b>です。","He's an excellent employee."
"610","仕方","way, method","仕方[しかた]","Noun","ファイルのダウンロードの<b> 仕方[しかた]</b>が 分[わ]かりません。","ファイルのダウンロードの<b>仕方</b>が分かりません。","I don't know how to download the file."
"611","うまい","good at (informal)","うまい","Adjective","彼[かれ]は 野球[やきゅう]が<b>うまい</b>。","彼は野球が<b>うまい</b>。","He's good at baseball."
"612","食事","meal, dinner (formal)","食事[しょくじ]","Verbal Noun","今日[きょう]は 上司[じょうし]と<b> 食事[しょくじ]</b>をする。","今日は上司と<b>食事</b>をする。","I'm eating with the boss today."
"613","火事","fire (emergency)","火事[かじ]","Noun","<b> 火事[かじ]</b>です。 119番[ひゃくじゅうきゅうばん]に 電話[でんわ]してください。","<b>火事</b>です。119番に電話してください。","There's a fire. Please call 119."
"614","大事","important (thing)","大事[だいじ]","Adjectival Noun","お 体[からだ]をお<b> 大事[だいじ]</b>に。","お体をお<b>大事</b>に。","Take care of yourself."
